question_id,title,topic_primary,url_slug,source_url,base_unweighted_n,base_weighted_n,moe_question_level,is_multiselect,options_count
2025-172_tech_behavior_23,How acceptable would it be for the government to restrict protest activities by Black Lives Matter to maintain public order?,tech_behavior,how-acceptable-would-it-be-for-the-government-to-restrict-protest-activities-by-black-lives-matter-to-maintain-public-order,https://reports.verasight.io/reports/verasight-human-llm-comparison-survey-2025-172#how-acceptable-would-it-be-for-the-government-to-restrict-protest-activities-by-black-lives-matter-to-maintain-public-order,1000,1000.0000000000024,+/- 3.2%,false,5
2025-172_tech_behavior_24,How acceptable would it be for the government to restrict protest activities by MAGA groups to maintain public order?,tech_behavior,how-acceptable-would-it-be-for-the-government-to-restrict-protest-activities-by-maga-groups-to-maintain-public-order,https://reports.verasight.io/reports/verasight-human-llm-comparison-survey-2025-172#how-acceptable-would-it-be-for-the-government-to-restrict-protest-activities-by-maga-groups-to-maintain-public-order,1000,1000.0000000000024,+/- 3.2%,false,5
2025-172_tech_behavior_25,"Which of the following do you think you could defeat on your own, unarmed in a fight?",tech_behavior,which-of-the-following-do-you-think-you-could-defeat-on-your-own-unarmed-in-a-fight,https://reports.verasight.io/reports/verasight-human-llm-comparison-survey-2025-172#which-of-the-following-do-you-think-you-could-defeat-on-your-own-unarmed-in-a-fight,1000,1000.0000000000024,+/- 3.2%,true,8
2025-172_tech_behavior_26,"To what extent do you agree with the following statement: ""If employees become more AI-savvy and use AI to boost and optimize their productivity (i.e., work alongside AI), the threat of jobs being replaced by AI will decrease.""",tech_behavior,to-what-extent-do-you-agree-with-the-following-statement-if-employees-become-more-ai-savvy-and-use-ai-to-boost-and-optimize-their-productivity-i-e-work-alongside-ai-the-threat-of,https://reports.verasight.io/reports/verasight-human-llm-comparison-survey-2025-172#to-what-extent-do-you-agree-with-the-following-statement-if-employees-become-more-ai-savvy-and-use-ai-to-boost-and-optimize-their-productivity-i-e-work-alongside-ai-the-threat-of-jobs-being-replaced-by-ai-will-decrease,1000,1000.0000000000024,+/- 3.2%,false,5
2025-172_tech_behavior_27,"What percentage of people do you think share your beliefs about what it means for a statement to be ""true""?",tech_behavior,what-percentage-of-people-do-you-think-share-your-beliefs-about-what-it-means-for-a-statement-to-be-true,https://reports.verasight.io/reports/verasight-human-llm-comparison-survey-2025-172#what-percentage-of-people-do-you-think-share-your-beliefs-about-what-it-means-for-a-statement-to-be-true,1000,1000.0000000000024,+/- 3.2%,false,7
2025-172_tech_behavior_28,"Do you believe that ChatGPT is male, female, some other gender, or has no gender?",tech_behavior,do-you-believe-that-chatgpt-is-male-female-some-other-gender-or-has-no-gender,https://reports.verasight.io/reports/verasight-human-llm-comparison-survey-2025-172#do-you-believe-that-chatgpt-is-male-female-some-other-gender-or-has-no-gender,1000,1000.0000000000024,+/- 3.2%,false,5
2025-172_tech_behavior_3,Statement 2: Sustainability is mostly marketing hype that doesn’t justify higher pr,tech_behavior,statement-2-sustainability-is-mostly-marketing-hype-that-doesn-t-justify-higher-pr,https://reports.verasight.io/reports/verasight-human-llm-comparison-survey-2025-172#statement-2-sustainability-is-mostly-marketing-hype-that-doesn-t-justify-higher-pr,1000,1000.0000000000024,+/- 3.2%,false,4
2025-172_tech_behavior_4,Which of the following best describes your reaction?,tech_behavior,which-of-the-following-best-describes-your-reaction,https://reports.verasight.io/reports/verasight-human-llm-comparison-survey-2025-172#which-of-the-following-best-describes-your-reaction,1000,1000.0000000000024,+/- 3.2%,false,5
2025-172_tech_behavior_5,Which of the following articles of clothing do you wear at least once a week during summer?,tech_behavior,which-of-the-following-articles-of-clothing-do-you-wear-at-least-once-a-week-during-summer,https://reports.verasight.io/reports/verasight-human-llm-comparison-survey-2025-172#which-of-the-following-articles-of-clothing-do-you-wear-at-least-once-a-week-during-summer,1000,1000.0000000000024,+/- 3.2%,true,7
2025-172_tech_behavior_6,Are you more optimistic or more concerned about the impact of artificial intelligence (AI) on America's future?,tech_behavior,are-you-more-optimistic-or-more-concerned-about-the-impact-of-artificial-intelligence-ai-on-america-s-future,https://reports.verasight.io/reports/verasight-human-llm-comparison-survey-2025-172#are-you-more-optimistic-or-more-concerned-about-the-impact-of-artificial-intelligence-ai-on-america-s-future,1000,1000.0000000000024,+/- 3.2%,false,5
2025-172_tech_behavior_7,"Thinking about your own day-to-day life right now, how would you describe your personal financial situation?",tech_behavior,thinking-about-your-own-day-to-day-life-right-now-how-would-you-describe-your-personal-financial-situation,https://reports.verasight.io/reports/verasight-human-llm-comparison-survey-2025-172#thinking-about-your-own-day-to-day-life-right-now-how-would-you-describe-your-personal-financial-situation,1000,1000.0000000000024,+/- 3.2%,false,5
2025-172_tech_behavior_8,How much do you think artificial intelligence (AI) will disrupt entry-level white-collar jobs in the next 5 years?,tech_behavior,how-much-do-you-think-artificial-intelligence-ai-will-disrupt-entry-level-white-collar-jobs-in-the-next-5-years,https://reports.verasight.io/reports/verasight-human-llm-comparison-survey-2025-172#how-much-do-you-think-artificial-intelligence-ai-will-disrupt-entry-level-white-collar-jobs-in-the-next-5-years,1000,1000.0000000000024,+/- 3.2%,false,6
2025-172_tech_behavior_9,"When money feels tight, which category do you cut first?",tech_behavior,when-money-feels-tight-which-category-do-you-cut-first,https://reports.verasight.io/reports/verasight-human-llm-comparison-survey-2025-172#when-money-feels-tight-which-category-do-you-cut-first,1000,1000.0000000000024,+/- 3.2%,false,7
